{
  "schema": "drperf.explorer.v1",
  "title": ".raw.F64SCh",
  "measurement": {
    "unit": "CPU instructions per call",
    "scope": "exclusive region work",
    "markerAdjustment": "legacy average estimate; retained for compatibility with drperf CLI",
    "composition": "none; no aggregate cost, latency, or parallelism model",
    "tolerance": {
      "absolute": 64.0,
      "relative": 0.05
    }
  },
  "provenance": {
    "rawDirectory": "Measured by examples/explorer/verify.sh (bundled portable example)",
    "sourceRoot": null,
    "runs": [
      {
        "file": "run.836474.json",
        "measurement": {
          "version": "0.3",
          "pid": 836474,
          "app": "pipeline",
          "excluded_cuda_module": "",
          "follow_unmarked_threads": false,
          "native_gx": false,
          "native_gx_hooks": 0,
          "native_gx_calls": 0,
          "max_states_per_region": 4096,
          "max_keys": 65536,
          "counter_budget_bytes": 103079215104,
          "counter_bytes": 1333788672,
          "excluded_cuda_exports": 0,
          "excluded_cuda_calls": 0,
          "excluded_instructions": 0,
          "rep_expand": true,
          "symbols": true,
          "max_slots": 1048576,
          "slots_used": 1025,
          "slots_overflow": 0,
          "counter_denied": 0,
          "marker_seen": true,
          "unmatched_ends": 0,
          "depth_overflows": 0,
          "state_overflows": 0,
          "threads": 2,
          "trace_records": 169,
          "trace_dropped": 0
        }
      }
    ]
  },
  "validity": {
    "errors": [],
    "traceErrors": []
  },
  "regions": [
    {
      "id": "copy",
      "name": "copy",
      "originalName": "copy",
      "states": [
        "bytes"
      ],
      "markerCalibration": 0.0,
      "diagnostics": [],
      "calls": 24,
      "droppedCalls": 0,
      "status": "modelled",
      "regimes": [
        {
          "coefficients": [
            32.0
          ],
          "constant": 19.0,
          "dependent": [],
          "points": [
            {
              "state": [
                112
              ],
              "calls": 1,
              "explained": 3603.0,
              "unexplained": 0,
              "waiting": 0
            },
            {
              "state": [
                496
              ],
              "calls": 1,
              "explained": 15891.0,
              "unexplained": 0,
              "waiting": 0
            },
            {
              "state": [
                560
              ],
              "calls": 1,
              "explained": 17939.0,
              "unexplained": 0,
              "waiting": 0
            },
            {
              "state": [
                624
              ],
              "calls": 1,
              "explained": 19987.0,
              "unexplained": 0,
              "waiting": 0
            },
            {
              "state": [
                688
              ],
              "calls": 1,
              "explained": 22035.0,
              "unexplained": 0,
              "waiting": 0
            },
            {
              "state": [
                736
              ],
              "calls": 1,
              "explained": 23571.0,
              "unexplained": 0,
              "waiting": 0
            },
            {
              "state": [
                752
              ],
              "calls": 1,
              "explained": 24083.0,
              "unexplained": 0,
              "waiting": 0
            },
            {
              "state": [
                768
              ],
              "calls": 1,
              "explained": 24595.0,
              "unexplained": 0,
              "waiting": 0
            },
            {
              "state": [
                800
              ],
              "calls": 1,
              "explained": 25619.0,
              "unexplained": 0,
              "waiting": 0
            },
            {
              "state": [
                816
              ],
              "calls": 1,
              "explained": 26131.0,
              "unexplained": 0,
              "waiting": 0
            },
            {
              "state": [
                832
              ],
              "calls": 1,
              "explained": 26643.0,
              "unexplained": 0,
              "waiting": 0
            },
            {
              "state": [
                864
              ],
              "calls": 1,
              "explained": 27667.0,
              "unexplained": 0,
              "waiting": 0
            },
            {
              "state": [
                880
              ],
              "calls": 1,
              "explained": 28179.0,
              "unexplained": 0,
              "waiting": 0
            },
            {
              "state": [
                896
              ],
              "calls": 1,
              "explained": 28691.0,
              "unexplained": 0,
              "waiting": 0
            },
            {
              "state": [
                928
              ],
              "calls": 1,
              "explained": 29715.0,
              "unexplained": 0,
              "waiting": 0
            },
            {
              "state": [
                944
              ],
              "calls": 1,
              "explained": 30227.0,
              "unexplained": 0,
              "waiting": 0
            },
            {
              "state": [
                1552
              ],
              "calls": 1,
              "explained": 49683.0,
              "unexplained": 0,
              "waiting": 0
            },
            {
              "state": [
                1648
              ],
              "calls": 1,
              "explained": 52755.0,
              "unexplained": 0,
              "waiting": 0
            },
            {
              "state": [
                1824
              ],
              "calls": 1,
              "explained": 58387.0,
              "unexplained": 0,
              "waiting": 0
            },
            {
              "state": [
                1920
              ],
              "calls": 1,
              "explained": 61459.0,
              "unexplained": 0,
              "waiting": 0
            },
            {
              "state": [
                2016
              ],
              "calls": 1,
              "explained": 64531.0,
              "unexplained": 0,
              "waiting": 0
            },
            {
              "state": [
                2112
              ],
              "calls": 1,
              "explained": 67603.0,
              "unexplained": 0,
              "waiting": 0
            },
            {
              "state": [
                2208
              ],
              "calls": 1,
              "explained": 70675.0,
              "unexplained": 0,
              "waiting": 0
            },
            {
              "state": [
                2304
              ],
              "calls": 1,
              "explained": 73747.0,
              "unexplained": 0,
              "waiting": 0
            }
          ],
          "range": [
            [
              112,
              2304
            ]
          ],
          "unexplainedShare": 0.0,
          "blocks": {
            "affine": 1,
            "constant": 8,
            "unexplained": 0
          },
          "attribution": {
            "coefficients": [
              [
                {
                  "module": "pipeline",
                  "function": "work",
                  "instructions": 32.0
                }
              ]
            ],
            "constant": [
              {
                "module": "pipeline",
                "function": "main",
                "instructions": 8.0
              },
              {
                "module": "pipeline",
                "function": "work",
                "instructions": 6.0
              },
              {
                "module": "libperfmark.so",
                "function": "perfmark_end",
                "instructions": 2.0
              },
              {
                "module": "pipeline",
                "function": "_init",
                "instructions": 2.0
              },
              {
                "module": "libperfmark.so",
                "function": "perfmark_begin",
                "instructions": 1.0
              }
            ],
            "unexplained": []
          },
          "markerCalibration": 0.0
        }
      ],
      "points": [
        {
          "state": [
            112
          ],
          "calls": 1,
          "recorded": 3603.0,
          "observed": 3603.0
        },
        {
          "state": [
            496
          ],
          "calls": 1,
          "recorded": 15891.0,
          "observed": 15891.0
        },
        {
          "state": [
            560
          ],
          "calls": 1,
          "recorded": 17939.0,
          "observed": 17939.0
        },
        {
          "state": [
            624
          ],
          "calls": 1,
          "recorded": 19987.0,
          "observed": 19987.0
        },
        {
          "state": [
            688
          ],
          "calls": 1,
          "recorded": 22035.0,
          "observed": 22035.0
        },
        {
          "state": [
            736
          ],
          "calls": 1,
          "recorded": 23571.0,
          "observed": 23571.0
        },
        {
          "state": [
            752
          ],
          "calls": 1,
          "recorded": 24083.0,
          "observed": 24083.0
        },
        {
          "state": [
            768
          ],
          "calls": 1,
          "recorded": 24595.0,
          "observed": 24595.0
        },
        {
          "state": [
            800
          ],
          "calls": 1,
          "recorded": 25619.0,
          "observed": 25619.0
        },
        {
          "state": [